{
  "protocolVersion": "2.0.0",
  "chainId": 5546,
  "operatorAddress": "0x1111111111111111111111111111111111111111",
  "sessionAddress": "0x2222222222222222222222222222222222222222",
  "delegationHash": "0xbbbbbbbbbbbbbbbbbbbbbbbbbbbbbbbbbbbbbbbbbbbbbbbbbbbbbbbbbbbbbbbb",
  "authorizationExpiresAt": "2026-08-03T20:00:00.000Z",
  "nodeId": "example-node-public-identity-0001",
  "sequence": 42,
  "issuedAt": "2026-07-31T20:00:00.000Z",
  "expiresAt": "2026-07-31T20:01:00.000Z",
  "nonce": "aaaaaaaaaaaaaaaaaaaaaaaaaaaaaaaaaaaaaaaaaaaaaaaaaaaaaaaaaaaaaaaa",
  "statusHash": "0xbbbbbbbbbbbbbbbbbbbbbbbbbbbbbbbbbbbbbbbbbbbbbbbbbbbbbbbbbbbbbbbb",
  "payloadHash": "0xcccccccccccccccccccccccccccccccccccccccccccccccccccccccccccccccc",
  "signature": "0xdddddddddddddddddddddddddddddddddddddddddddddddddddddddddddddddddddddddddddddddddddddddddddddddddddddddddddddddddddddddddddddddddd"
}
